Id	Day	Type	Lines		
1	1	Opening	안녕, (userName)야?\n우리는 민들레씨야. 숲 밖으로 날아가 보고 싶은데 너무 무서워서 용기가 안 나...	하루에 30분씩 창문을 열어 두고 날아갈 연습을 하면 나아질 수 있을 것 같아.	우리가 용기를 낼 수 있게, (userName)가 도와주겠니?
2	1	Ending	(userName)야 고마워!	아직은 날아갈 용기가 부족하지만,	네 덕분에 우리가 시원한 바깥바람을 느껴볼 수 있었어.
3	2	Ending	(userName)야,\n오늘은 창문 밖으로 날아가는 새를 봤어.	우리도 그렇게 날아볼 수 있겠지?	네가 응원해준 덕에 힘이 나는 것 같아.
4	3	Ending	(userName)야! 그거 알아?\n우리 중에 씨앗 하나가 오늘 비행에 성공했어!	바람을 타고 날아오르는 모습이 정말 멋진 거 있지?	(userName) 덕분이라구,\n꼭 전해달라고 하더라 :)
5	4	Ending	안녕, (userName)?\n우리도 이제 용기가 생겼어.	저 높은 하늘로 훨훨 날아가볼게, 정말 고마워!\n그런데 있잖아... 씨앗 하나가 아직 무서워서 같이 못 가겠대.	이 친구 곁에 (userName)가\n함께 해줄래?
6	5	Ending	(userName)야!\n오늘도 나를 위해 창문을 열어줬구나?	사실, 나만 남아서 조금 주눅이 들었어...\n그렇지만 네가 꼭 날아가지 않아도 괜찮다고 말해줘서 위로가 됐어.	고마워 (userName).
7	6	Ending	(userName)야.\n오늘 하늘에 뜬 민들레 모양 구름 봤어?	친구들이 너처럼 나를 응원해주는 걸까?\n나 왠지... 내일이면 날아갈 용기가 생길 것 같아.	다 (userName) 덕분이야!
8	7	Ending	(userName)야,\n나는 이제 바람을 타고 날아가보려고 해.	네 따뜻한 마음이 나에게 큰 도움이 되었어.\n너무 멀리 가지 않을 테니까 걱정 마 :)	아침에 일어나서 창문을 열어두면 내가 꼭 다시 돌아올게.\n정원에서 만나!
